{
  "@context": [
    "https://www.w3.org/ns/credentials/v2",
    "https://vc4qi.example/contexts/gs/1"
  ],
  "id": "https://nab.vc4qi.example/credentials/GS-A",
  "type": [
    "VerifiableCredential",
    "GsAccreditation"
  ],
  "issuer": "https://nab.vc4qi.example/controller",
  "validFrom": "2024-01-01T00:00:00Z",
  "validUntil": "2029-01-01T00:00:00Z",
  "credentialSchema": {
    "id": "https://vc4qi.example/schemas/gs/1/accreditation.json",
    "type": "JsonSchema"
  },
  "credentialSubject": {
    "id": "https://gs-body.vc4qi.example/controller",
    "permittedActivity": [
      "https://vc4qi.example/bindings/gs/1#certifyProducts"
    ],
    "scope": [
      {
        "id": "https://nab.vc4qi.example/credentials/GS-A#scope-toys",
        "productCategoryIri": "https://vc4qi.example/bindings/gs/1#Toy",
        "standardIris": [
          "https://vc4qi.example/bindings/gs/1#EN-71-1",
          "https://vc4qi.example/bindings/gs/1#EN-71-2"
        ]
      },
      {
        "id": "https://nab.vc4qi.example/credentials/GS-A#scope-household",
        "productCategoryIri": "https://vc4qi.example/bindings/gs/1#HouseholdAppliance",
        "standardIris": [
          "https://vc4qi.example/bindings/gs/1#EN-60335-1",
          "https://vc4qi.example/bindings/gs/1#EN-60335-2-23"
        ]
      }
    ]
  },
  "credentialStatus": {
    "id": "https://nab.vc4qi.example/status/gs/1#0",
    "type": "BitstringStatusListEntry",
    "statusPurpose": "revocation",
    "statusListIndex": "0",
    "statusListCredential": "https://nab.vc4qi.example/status/gs/1"
  },
  "proof": {
    "type": "DataIntegrityProof",
    "cryptosuite": "eddsa-rdfc-2022",
    "proofPurpose": "assertionMethod",
    "verificationMethod": "https://nab.vc4qi.example/controller#key-1",
    "created": "2024-01-01T00:00:00Z",
    "proofValue": "z4CVMZsccqCu2u5yTNLCwLgc5VAR8XMVTwGGTq8wxwBm4qYyNntDAxAiYquBCjkGUESd5KftNEpFBzhYBCwb1q5HL"
  }
}
